S.No,Question,Answer
,IoT,"The latest buzzword is Internet of Things or IOT. IOT is the interconnection of computing devices in embedded objects (sensors, wearables, cars, fridges etc.) via internet and they enable sending / receiving data. IOT generates huge amounts of data presenting many big data analytics opportunities."
,MapReduce,"MapReduce could be little bit confusing but let me give it a try. MapReduce is a programming model and the best way to understand this is to note that Map and Reduce are two separate items. In this, the programming model first breaks up the big data dataset into pieces (in technical terms into ‘tuples’ but let’s not get too technical here) so it can be distributed across different computers in different locations (i.e. cluster computing described earlier) which is essentially the Map part. Then the model collects the results and ‘reduces’ them into one report. MapReduce’s data processing model goes hand-in-hand with hadoop’s distributed file system."
,NoSQL,It almost sounds like a protest against ‘SQL (Structured Query Language) which is the bread-and-butter for traditional Relational Database Management Systems (RDBMS) but NOSQL actually stands for Not ONLY SQL :-). NoSQL actually refers to database management systems that are designed to handle large volumes of data that does not have a structure or what’s technically called a ‘schema’ (like relational databases have). NoSQL databases are often well-suited for big data systems because of their flexibility and distributed-first architecture needed for large unstructured databases.
,Spark (Apache Spark),"Apache Spark is a fast, in-memory data processing engine to efficiently execute streaming, machine learning or SQL workloads that require fast iterative access to datasets. Spark is generally a lot faster than MapReduce that we discussed earlier."
,Stream processing,"Stream processing is designed to act on real-time and streaming data with “continuous” queries. Combined with streaming analytics i.e. the ability to continuously calculate mathematical or statistical analytics on the fly within the stream, stream processing solutions are designed to handle high volume in real time. "
,Hello,Hello data nerds .How are you?
,Do you know about Data science,Yes Sir/Mam.Anything You ask?
,Data,Raw Facts and figure
,logistic regression,Logistic regression measures the relationship between the dependent variable (our label of what we want to predict) and one or more independent variables (our features) by estimating probability using its underlying logistic function (sigmoid).
,Univariate,Univariate data contains only one variable. The purpose of the univariate analysis is to describe the data and find patterns that exist within it. 
,Bivariate,Bivariate data involves two different variables. The analysis of this type of data deals with causes and relationships and the analysis is done to determine the relationship between the two variables.
,Multivariate,"Multivariate data involves three or more variables, it is categorized under multivariate. It is similar to a bivariate but contains more than one dependent variable."
,Forward Selection,We test one feature at a time and keep adding them until we get a good fit
,Backward Selection, We test all the features and start removing them to see what works better
,Recursive Feature Elimination,Recursively looks through all the different features and how they pair together
,You are given a data set consisting of variables with more than 30 percent missing values. How will you deal with them?,"The following are ways to handle missing data values:    If the data set is large, we can just simply remove the rows with missing data values. It is the quickest way; we use the rest of the data to predict the values.               For smaller data sets, we can substitute missing values with the mean or average of the rest of the data using the pandas' data frame in python. There are different ways to do so, such as df.mean(), df.fillna(mean)."
,dimensionality reductio,The Dimensionality reduction refers to the process of converting a data set with vast dimensions into data with fewer dimensions (fields) to convey similar information concisely.
,Monitor,"Constant monitoring of all models is needed to determine their performance accuracy. When you change something, you want to figure out how your changes are going to affect things. This needs to be monitored to ensure it's doing what it's supposed to do."
,recommender systems,A recommender system predicts what a user would rate a specific product based on their preferences.
,RMSE,Root Mean Square Error. 
,MSE, Mean Square Error.
,How can you select k for k-means? ,We use the elbow method to select k for k-means clustering. The idea of the elbow method is to run k-means clustering on the data set where 'k' is the number of clusters.
,How can outlier values be treated?,"You can drop outliers only if it is a garbage value. If the outliers have extreme values, they can be removed. For example, if all the data points are clustered between zero to 10, but one point lies at 100, then we can remove this point."
,How can time-series data be declared as stationery?,It is stationary when the variance and mean of the series are constant with time
,feature vectors,"A feature vector is an n-dimensional vector of numerical features that represent an object. In machine learning, feature vectors are used to represent numeric or symbolic characteristics (called features) of an object in a mathematical way that's easy to analyze."
,root cause analysis,Root cause analysis was initially developed to analyze industrial accidents but is now widely used in other areas. It is a problem-solving technique used for isolating the root causes of faults or problems. A factor is called a root cause if its deduction from the problem-fault-sequence averts the final undesirable event from recurring.
, cross-validation.,Cross-validation is a model validation technique for evaluating how the outcomes of a statistical analysis will generalize to an independent data set. It is mainly used in backgrounds where the objective is to forecast and one wants to estimate how accurately a model will accomplish in practice. 
,collaborative filterin,"Most recommender systems use this filtering process to find patterns and information by collaborating perspectives, numerous data sources, and several agents."
,What is the law of large numbers?,"It is a theorem that describes the result of performing the same experiment very frequently. This theorem forms the basis of frequency-style thinking. It states that the sample mean, sample variance, and sample standard deviation converge to what they are trying to estimate."
,star schema,"It is a traditional database schema with a central table. Satellite tables map IDs to physical names or descriptions and can be connected to the central fact table using the ID fields; these tables are known as lookup tables and are principally useful in real-time applications, as they save a lot of memory. Sometimes, star schemas involve several layers of summarization to recover information faster."
,confounding variables,These are extraneous variables in a statistical model that correlates directly or inversely with both the dependent and the independent variable. The estimate fails to account for the confounding factor.
,eigenvalue,"Eigenvalues are the directions along which a particular linear transformation acts by flipping, compressing, or stretching."
,eigenvector,"Eigenvectors are for understanding linear transformations. In data analysis, we usually calculate the eigenvectors for a correlation or covariance matrix. "
,selection bias,"Selection bias, in general, is a problematic situation in which error is introduced due to a non-random population sample."
,survivorship bias,Survivorship bias is the logical error of focusing on aspects that support surviving a process and casually overlooking those that did not because of their lack of prominence. This can lead to wrong conclusions in numerous ways.
